{
  "schema_version": "1.0.0",
  "generated_at": "2026-10-20T04:58:00-07:00",
  "project": "fencepost",
  "meta": {
    "github": "ok",
    "ledger": "ok",
    "ledger_last_entry_at": "2026-10-20T04:58:00-07:00"
  },
  "nodes": [
    {
      "id": "manpreet",
      "label": "Manpreet",
      "group": "owner",
      "status": "IDLE",
      "agent_links": [],
      "layout": {
        "x": 400,
        "y": 0
      }
    },
    {
      "id": "director",
      "label": "Director",
      "group": "build",
      "status": "IDLE",
      "agent_links": [],
      "layout": {
        "x": 400,
        "y": 72
      }
    },
    {
      "id": "architect",
      "label": "Architect",
      "group": "build",
      "status": "IDLE",
      "agent_links": [
        "bc-9f84dbdb"
      ],
      "layout": {
        "x": 400,
        "y": 144
      }
    },
    {
      "id": "dev-1",
      "label": "DEV 1",
      "group": "build",
      "status": "IDLE",
      "agent_links": [
        "bc-1a2b3c4d"
      ],
      "layout": {
        "x": 80,
        "y": 256
      }
    },
    {
      "id": "dev-2",
      "label": "DEV 2",
      "group": "build",
      "status": "IDLE",
      "agent_links": [],
      "layout": {
        "x": 240,
        "y": 256
      }
    },
    {
      "id": "ui-ux-maker",
      "label": "UI/UX Maker",
      "group": "build",
      "status": "IDLE",
      "agent_links": [],
      "layout": {
        "x": 400,
        "y": 256
      }
    },
    {
      "id": "documentation",
      "label": "Documentation",
      "group": "build",
      "status": "IDLE",
      "agent_links": [],
      "layout": {
        "x": 560,
        "y": 256
      }
    },
    {
      "id": "qa-verifier",
      "label": "QA / Verifier",
      "group": "qr",
      "status": "IDLE",
      "agent_links": [],
      "layout": {
        "x": 800,
        "y": 176
      }
    },
    {
      "id": "security-engineer",
      "label": "Security Engineer",
      "group": "qr",
      "status": "IDLE",
      "agent_links": [],
      "layout": {
        "x": 800,
        "y": 256
      }
    },
    {
      "id": "devops-release",
      "label": "DevOps / Release",
      "group": "qr",
      "status": "IDLE",
      "agent_links": [],
      "layout": {
        "x": 800,
        "y": 336
      }
    },
    {
      "id": "scout",
      "label": "Scout",
      "group": "radar",
      "status": "IDLE",
      "agent_links": [],
      "layout": {
        "x": 80,
        "y": 384
      }
    },
    {
      "id": "skeptic",
      "label": "Skeptic",
      "group": "radar",
      "status": "IDLE",
      "agent_links": [],
      "layout": {
        "x": 240,
        "y": 384
      }
    },
    {
      "id": "nomen",
      "label": "NOMEN",
      "group": "radar",
      "status": "IDLE",
      "agent_links": [],
      "layout": {
        "x": 400,
        "y": 384
      }
    },
    {
      "id": "bug-fixer",
      "label": "Bug fixer",
      "group": "radar",
      "status": "IDLE",
      "agent_links": [],
      "layout": {
        "x": 560,
        "y": 384
      }
    }
  ],
  "tasks": [],
  "events": [],
  "edges": [],
  "unparsed": []
}
